{
  "name": "lecture-design",
  "displayName": "Teaching methods & pedagogy",
  "description": "A folder-ized pedagogy library for lecture/curriculum design — the evidence-based default (backward design, prerequisite graphs, generative learning, spaced retrieval, feed-forward) plus named methodologies (5E, CRA, Peer Instruction, Mayer, Merrill). Skill-only. A default pack: auto-installed at `faraday new`.",
  "runtime": {},
  "skill": {
    "reference": "skill",
    "entry": "overview.md",
    "loadWhen": "you are designing how a lesson or curriculum teaches — choosing a methodology, sequencing, assessment cadence, or feedback"
  },
  "quality": "quality.md"
}
