{
  "name": "game2d",
  "displayName": "2D game stage (PixiJS)",
  "description": "Educational 2D game stage on PixiJS v8 + @pixi/react — Application host, Matter.js physics, tilemaps, and a Howler audio manager. Author-editable glue copies into src/lesson/game2d. Audience-specific shells (e.g. storybook-game2d) require this pack.",
  "default": true,
  "runtime": {
    "dependencies": {
      "@pixi/react": "^8.0.5",
      "howler": "^2.2.4",
      "matter-js": "^0.20.0",
      "pixi.js": "^8.19.0"
    },
    "devDependencies": {
      "@types/howler": "^2.2.12",
      "@types/matter-js": "^0.19.8"
    },
    "copy": [
      { "from": "runtime/game2d", "to": "src/lesson/game2d" },
      { "from": "examples", "to": "docs/examples" },
      { "from": "assets/README.md", "to": "public/assets/game2d/README.md" }
    ]
  },
  "skill": {
    "reference": "skill",
    "entry": "SKILL.md",
    "loadWhen": "the lesson needs a 2D game canvas — sprites, tilemaps, physics toys, or interactive stages built with PixiJS"
  },
  "quality": "quality.md"
}
